Index,Sinhala Comment
149,කාලයක් තුල ඔබට ඇහුම්කන් නොදුන් සියලු දෙනා අද ඔබගේ කතාව ගැන ඉහලින්ම කතා කරනවා ඔබ තරම් නිහතමානි ඉතා මතක ශක්තියෙන් යුතු කලහාකාරි හැසිරීම් නැති කතා කිරීමේදී පවා අති දක්ශ රට වෙනුවෙන් හඩ නැගූ හොර වංචාවන්ට දැඩි සේ විරුද්ධ වූ ඔබට මෙපමන කාලයක් අවධානය නොදුන් අප අද ඒ ගැන යම් කලකිරීමක් ඇති කර ගත් නමුත් මේ වෙද්දි ඔබ ජනතා ආදරය ගෞරවය දිනාගෙන යන්න ඕනි ඉහළම සුදුසුම තැනට යන්න ලැබීම ගැන ගොඩක් ආඩම්බරයෙන් සතුටු වෙමි ගරු ජනාධිපතිතුමනි රට වෙනුවෙන් යහපත් තීරණම ගන්න ශක්තිය ධෛර්යය ලැබේවා
150,ඔබතුමාට
151,ජාතියේ පිනට පහල වූ විරුවාණනිඔබට සියලු දෙවියන්ගේ රැකවරණයි
152,සිංහයා තනියම නරි රැල එක්ක සටනක
153,ආදරෙයි ජනාධිපති තුමා
154,අපි එදත් ඔබතුමාගෙ කතාව ඇසුවා එදා සිටම ඔබ ජනපතිමයි තෙරුවන් සරණයි
155,ඔබ සිංහයෙක් ජනාධිපතිතුමෙනි
156,ඔබ තුමාට දේව ආශිර්වාදය ලැබේවා
157,අනුර කුමාර ජනාදිපති ඔබට තෙරුවන් සරනය්
158,ගරුජන අදිපතිතුමනිපර්මෙන්තුයින්නෙමීහරර්ක් ඔ බතුමාටජයෙන්ජයමවෙවා
159,මෙතුමා උගුර වේලනකම් කෑගහනවා ඒ වෙලාවේ හරිනි මැතිනිය වතුර අහනවා මෙතුමා ට බොන්න දෙන්න බලන්න කොහොමද එකමුතු කම
160,දැන් මේක බලද්දි පාර්ලිමේන්තුවෙ විකාර නැටුව ගොඩක් අය පාර්ලිමේන්තුවෙ නැ ඒ වෙනුවට ක අති බහුතර බලයකින් පත්වුන මාලිමා ආණ්ඩුව තියෙන්නෙ ආදරෙයි
161,අද කොහේද ඔය නරි ටික එළියට ඇද දැම්මා ජනතාව තේරුම් ගත යුතුයි අනුර අද ජනපති
162,ලංකාවට ඉන්න එකම සිංහයා ඔබයි
163,ආණ්ඩුවේ කැබිනට් එකත් දිවුරුම් දුන්නට පස්සේ බලන මම
164,ඒද පාර්ලිමේන්තුවෙ තනියම කැගහාපු කෙනා අද මුලු පාර්ලිමේන්තුවම එකමිටකට ගත්තා ඔය කැගහාන හොර සක්කිලි හැත්ත අද බලුකුක්කෝ වගේ නැටිට අකුලගෙන ගෙදර ගියා පටිට හොරැ රැල රට කාබාසනය කරලා ගියේ අපේ ජනාධිපතිතුමාට තිස්තුන් කෝටියක් දෙවියන්ගේ ආරක්ෂාව ලැබෙිවා බුදු සරනයි මාලිමාවට ජය වෙිවා
165,ජය වේවා අද අපේ ජනාධිපතිවරයා ඔබතුමා දීර්ඝායුෂ ලැබේවා දළදා සම්දු පිහිටෙන් සියලුම හොඳ දේ කරන්න ශක්තිය ධෛර්යය ලැබේවා බුදුසරණ යි ඔබතුමාට ආදරෙයි අපි හැමෝම
166,දැන්නම් දුකයි වගේ මොකද ඉස්සරහට අනුර පාර්ලිමේන්තුවේ නැති නිසා
167,මම අදයි මේක බැලුවේ උගුර කට ලේ රහ වෙනතුරු කිව යුතු දේ කිව්වා අනේ වතුර ටිකක් වත් නැහැනේ කියලා මං හිත හිත හිටියේ අයියෝ ඊට ටික වෙලාවකට පස්සේ මං දැක්ක වතුර එකක් ගෙනත් දෙනවා මං හරිම දුකින් බලන් හිටියේ අනිත් පැත්තේ හිටපු අය පිස්සෝ වගේ කෑගහනවා ඔවුන් ගැන හරි පුදුමයි එදා තත්ත්වේ ගැන එහෙම හිතුවට අනේ දැන් අපේ ජනාධිපති තුමා වෙලානේ ඔබ එදා ඒ වපුරපු දේ පිරී ඉතිරී යන්න අස්වැන්න නෙලාගෙන තියෙනවා අනේ වටේ ඉන්න සොයුරු සොයුරියන් ටික ඒ අස්වැන්න අපතේ නොයවා නෙලා ගන්න එතුමාට උදව් කරන්න අනේ මමත් පුළුවන් හැටියට උදව් කරනවා රට වෙනුවෙන් සහ අනාගතය බාරගන්න ඉන්න ලොකු කුඩා ළදරු සෑම දරුවෙක් වෙනුවෙන් ම අපේ ජනාධිපති තුමා ඇතුළු සැමටම ඒ වෙනුවෙන් කටයුතු කිරීමට දිරිය සවිය ලැබේවා ජේසු පිහිටයි
168,අද මුළු ශ්රීලංකාවම පිළිතුරු දුන්නා ඔබ ජනාධිපති පුටුවේ හිදුවල ආදරෙයි අනුර සහෝදරයා
169,අද අපේ ජනාධිපතිතුමා ඉදිරියේ අද බල්ලන්ගේ කට වැස්සුවා ජනතාව
170,නියමයි අපේ සිංහයා
171,රත්තරං මනුස්සයෙක්
172,එදා කතා කරපුව හොයහොයා බලන මම ආදරෙයි ජනපති තුමනි
173,ය වගේ පාර්ලිමේන්තුවක් ආයේ නම් ඕනේ නැහැ ඔබ අද ජනාධිපති හරිම සතුටුයි
174,මේ අහන්න මගේ තනි මතයක් මං කියන්න කැමතියි මෛත්රීපාල ඡානාධි පතිව සිටින කාලය තුලදී රටේ ආරක්ෂාවට තර්ඡනයක් ඇති බවට පෙන්වා ගෝඨාඇතුළු උගේ සංවිධානාත්මක කන්ඩායම විසින් කුමන්ත්රණයක් කරමින් ඉක්මන් ඡානාධි පති ධුරයක් ලබා ගැනීමේ අටියෙන් පාස්කු බෝමබ ප්රහාරය දියත් කරමින් අහිංසක ඡීවිත ගනණාවක්ම බිලිගත්ත කියල මම එක හෙලා කියනව
175,ඒක තමා හැමෝම කියන්නෙ
176,නියමයි ඹබ තුමා අද මී හරක් ඹක්කොම කැලේටම එලෙවිවාහරිම ආඩමිබරයිඹබ තුමාට තෙරැවන් සරනයි
177,ඔබ තුමාට තෙරුවන් සරණයිජයෙන් ජය වේවා
178,බලය කියන්නෙ ජනතාව
179,කොහොමද එ ගැම්ම
180,උගුරලේ රහ වෙනකල් කෑ ගහලා ඔබ තුමාට ඉරෝගි අයුශ ලැබෙවා
181,තබා ගෙන පුංචි මිනිස්සු වෙනුවෙන් තනියම ගේම ඉල්ලපු ඔබ තුමා අද ජනපති මිනිස්සු ගේ හිත හදලා අද ලබා ගත් ජය ග්රහණය නියම කම්බුල් පාරක් ඔය පර හැති කරේටජයවේවා අපේ අනුර ජනපතිදුන්ට
182,සුපිරි අහගෙන ඉන්න බෑ තනියම ගේම ගහලා මෙ වෙනකල් අනුර ඔබතුමාට ජය
183,මේ ඉන්නේ අපේ චන්ඩි ජනාදිපති දැන් කොහෝම හරි රජ වුණා ජයවේවා
184,බලය කියන්නෙ මේ රටේ ජනතාව නියමයිචිරං ජයතු ජනාධිපති තුමනි
185,මීටකලින් මේවා අහල තිබ්බ නම් අපි පළමු ජන්දේ ඉදලම මේ පක්ෂයේ
186,මම මේ දන්නේ අහන්නේමිට කලින් අහලා තිබ්බේ නෑ
187,ගොන් බල්ලන්ගෙ සද්දෙ දැන් කොහොමද රොත්ත පිටින් ගියේ
188,විපක්ෂයට උණගැනෙන්න කියල දුන්න
189,මම ප්රාර්ථනා කරනව උණක් හෙම්බිරිස්සාවක් හැදෙන්න එපා කියල තෙරුවන් සරණයි
190,ඇසුවේ නැහැ නේද කියලා
191,බල්ලෝ උඩූ බූරනවා සිංහයා අැත්ත කියද්දි
192,ගව රැල තාම කැ ගහනවා ලෑඡගා නැදද මූනට තාම
193,දී ගැම්ම එහෙම නම් දැන් ආවොත් ජෝනී උස්සලා පොලොවේ ගහයි යකූ
194,ඔන්න ජනාධිපති උනාට පස්සෙත් අපි මේක බලනවා මින් ඉදිරියට අපේ ජීවිත මෙතුමා ආරක්ෂා කරාවි
195,සතුටුයි ජනාධිපති තුමාට නිර්භිතයි දැන්මේව ගැන හිතමු නේද
196,තනියම සටන් කරපු අපේ ජනාධිපති
197,ඒ ධෛර්යය ඒ ශක්තිය සත්යය ගලාගෙන යනවා අපේ ජනපති රාජපක්ෂලා තිරිසනුන් රටේ සල්ලිවලින් රජසැප විඳිමින් උද්ධච්ච කමින් තවමත් කියන්නෙ අතාරින්නෙ නෑලු තණ්හාව රෑට බීලා වෙව්ල වෙව්ලා ඉස්සර උත්සව වලට එන්නෙ රටක් පාලනය කලා නෙවි රට කෑවා
198,අද මුලු පාර්ලිමේන්තුවෙන් ක් අනුරගෙ
199,මිනීමරු ගෝඨාට දඬුවම් ලබාදෙන්න ජනාධිපති තුමනි පොත් ලියලා සුද්ධවන්තයා වෙන්න හදන මිනීමරුවන්
200,අනෙ අනුර සහොදරයා ගෙ කතා සත්යක් ඔය මොන්ටිසොරියෙ කැ ගහපු බලු කුක්කො ඔක්කොම අද පාරෙ වැදගත් ඉතා වටින කතාවක් එකාලෙ ජනාධිපති තුම්නි ඔබකරල තියෙන්නෙ වර්තමාන යට මෙක වටිනව හොරා කාපු කැගහපු හිනා උන උන්ට අද මොකද උනෙ ඔක තමා එදා අනුර සහොදරයා උගුර ලෙ රහවෙනකම් කිවෙ
201,මේක බලනකොට මහ මැතිවරණයෙන් මාලිමාවට බලයක් ලැබිලා ආසන ක් දැන් බලය තියනව ඔබට මේ අයට දඩුවම් දෙන්න
202,නොවැම්බර් චන්දෙන් පස්සේ මේක බලන මම ලොවෙත් නැති උනා කට්ටිය
203,නියමයි අනුර නියමයි හොරුන්ට අද කතා කරන්න එන්න බැහැ පැරදිලා දිට්ට ධම්ම වේදනීය කර්මේ උන්ට පළදිලා හොර හැතිකරේ ජයවේවා අනුර
204,ඔය පිස්සො බොරු පොරොන්දු දීලා බලයට අවහම මිනිස්සුන්ව අමතක කරලා ගනන්නේ නැතුව තමුන්ගෙ දේපල සල්ලි උපයා ගත්තා අමතක කලා මිනිස්සුන්ට තමයි බලය තියන්නෙ කියලා
205,අවුරුදු ක් තිස්සෙ උගුරෙ ලේ රහ වෙනකන් කෑ ගහන්න උනා මිනිස්සුන්ට ඇත්ත තත්වය තෙරුම් කරන්න තවත් ඉන්නවා තේරුම් ගන්න බැරි වාසියට ඔය හොරුන්ට කඩේ යන මොඩ රැලක්
206,ඇත්ත කියනකොට අහගෙන ඉන්න බැරි තරම් හැදියාවක් නැති එවුන්ද රට පලනය කරන්න චන්දෙ දෙන්නේ
207,යකෝ මේක අහද්දි දැන් ආතල් එක
208,නැවත මේ එක බලද්දි දැන් ඔබ ජනපති න් ක බලයක් සහිත ආණ්ඩුවක
209,න් කටත් වැඩියි න්ක බලයක්
210,අපේ ජනාධිපතිතුමා
211,ඔබතුමා එදා පාර්ලිමේන්තු වෙ ජනතාව වෙනුවෙන් නැඟී හඩ ඉතා පැහැදිලි යි අපිට හරිම සතුටුයි අද අපේ රටේ ිආදරණිය ජනාධිපති ඔබතුමාට දීර්ඝායුෂ ලැබේ වඩා රට දියුණු කරන්න ට ශක්තිය ලැබේවා
212,ඔබ අපේ වීරයා
213,ඔබ කලු සින්හලයින්ගේ කලු සින්හයා
214,ගරු ජනාධිපතිතුමනිඔබට ජයසිරි මහා සමිදුගේ පිහිටයිඔබේ කතාව එදා අපිට නොතේරුනේ ඇයිවිශිෂ්ටයී ගරු ජනාධිපතිතුමනිඇස් වලට කදුලු එනවා මේක බලද්දී
215,ගොඩක් අයට මෙතුමාව තේරුම් ගන්න කල් ගියා හැබැයි සීයට තුනේ ගොඩේ අපි හිටියා අපි ඡන්දෙ දුන්නත් ඒක හොර රහසේ ඒක වහං කරගෙන හිටියා මොකද අපිට ගෙවල්වල ඉන්න දෙන්නැති දෙන්නැති දෙන්නැතිවෙයි පොහොට්ටුවේ උන් කියලා හැබැයි මේ පාර ප්රසිද්ධියේ ගිහින් මාලිමාවට ඡන්දෙ දාල අප්රසිද්ධියේ කියලාජනාධිපතිවරණයත් මහ සභාව මැතිවරණයත් ඒ වගේම ඉදිරියට එන පළාත් පාලන මැතිවරණයත් අපි මාලි මාවට ඔබතුමාට තෙරුවන් සරණයි දළදා හාමුදුරුවෝ පීපිහිටයි සියයට තුනක් හිටියදී පවා අපි විශ්වාසෙක එකම දේ ඔබ පාර්ලිමිත්තයේ සිටිය යුත්තෙක් බවයි
216,ඇත්තටම එදා ඒ නිවට නියාලුවන් කපටියන් අත්තනෝ මතිකයින් බහුතරයක් මැද තනියම සටන ගෙනගිය සත්යයේ හඬ අද අප රටේ ජනාධිපති මේ වන විට මහමැතිවරණයද ඉතා ඉහළින්ම දිනන්නට ජනතාව තීන්දුව දී හමාරයි දැං ඉතින් හැම දෙනාම එකතු වී මේ රට ලස්සන වාසනාවන්ත රටක් කරමු අනාගත දරුවන් උසෙසා
217,අපේ ජනපති ජයවේවා
218,එදා මන්ත්රි කෙනෙක් වෙලා ඉද්දි එහෙම ගැම්මකින් කථා කලානම් ජනාදිපති දැන් අපිට හිතාගන්න පුළුවන් ජනතාව වෙනුවෙන් ඉදිරි වත් වෙන විදිය
219,එදා මේ වීඩියෝ එක බලලා අද බලද්දි හිතට පුදුම සතුටක් සහ ආඩම්බරයක් දැනෙන්නෙ
220,සදා ආදරෙයි තමයි කොහොමද එදා එකට එදා වන්දි චප්ප
221,අනේ මේ බල්ලො බුරන්නේ අනාගත ජනාධිපතිට බව දන්නවා නම්
222,හරක් ටික උම්බෑ කියනවාඒ හරක් එකෙක්වත් දැන් නෑ අපෙ හාමුදුරුවනේ
223,පව් දෙයියනේ උගුර ලේ රහ වෙනකම් කෑ ගහ්න්නෙ අපි වෙනුවෙන් නේද
224,අපි ඔබට දීපු ඡන්දයෙ වටිනාකම මිල කරන්න බෑ මැතිදුනි ඔබ තුමාට දීර්ඝායුෂ ඔබ අප වෙනුවෙන් කොපමන අවලාද විදිනවද ඇත්තටම ඡනාධිපතිතුමනි ඔබ තමයි මේ රටේ සැබා නායකයා ඡයවේවා
225,විස්වාස කරනවා ආයෙත් පාර්ලිමේන්තුවේ මෙවන් කතා නොමැතිවෙයි කියලා පාර්ලිමේන්තුවේ සංවර්ධන වැඩපිළිවෙළක් ජනතාවට විය යුතු සේවයක් පිළිබඳව කතා පමනක් අසන්නට ලැබෙයි කියලා විනයක් නොමැති දේශපාලකයන් ආයෙත් දකින්නට නොලැබෙයි කියලා සුබ ගමනකට සාර්තක වැඩ පිළිවෙළක් සදහා යහපත් අනාගතයකට ජනතාව වෙනුවෙන් සේවයක් කිරීමට ඔබට සුබ පැතුම් සහෝදරයා
226,ආඩම්බරයි සහෝදරයා ඔබ ගැන
227,ඩෙලෝල් ගැලුම් පිටින් දමල මේ ව්ෂබීජ නසපු ඔබ තුමාට මාලිමාවට ජයවේවා ඔබට ඉන්දියන් සාගරේ මුතු ඇලය නැවත ගොඩ ගන්න දලදා සම්දුගේ පිහිටෙන් ද්ර්ය ශක්තිය ල්රුබේවා
228,අද සතුටු කදුලු අපි වෙනුවෙන් කෑ මොරදුන් ඔබගේ වෙනස
229,ඔබ එදා කතා කරද්දි උඩපුරපු බල්ලෝ ගැන අද කණගාටුවෙන් කියන්න කැමති ගෙදර ගිහින් බනක් අහගෙන සැහැල්ලුවෙන් ජිවත් වෙන්න කියලා
230,ඔබතුමා නිර්බීත නායකයා යා විම සතුටක්
231,ඔබතුමාරටේදෙවියා
232,දෙකක් නෑ නායකයෙක්
233,අනිවාර්යෙන්
234,මමත්
235,ජ අනේ දෙවියනේ රට වෙනුවෙන් කොචිචර කඍ ගහලද අද මෙි තත්වෙට ආවෙි අනේ අපේ දෙවියා ජයශුිමා බෝ සමිදුනි සරනයි
236,ජයවේවා ඔබ තුමාට
237,සමාඡයක් සහා මහා ඡනතාව වෙනුවෙන් කැප කර කටේ ලේ රස එනකන් කථා කරා අද ඔබ රඡෙකි ආදරෙයි සහෝදර යා
238,අනුර මහත්තයා මීට අවුරුදු දෙකකට කළින් උගුර රිදෙනකමි කරගහපු එකෙ පුතිපල අද අරන් තියනවාද ඔබවත් හිතන්න නැතිව ඇති අවුරුදු දෙකකින් ජනාධිපති වෙයි කියලාඔබට තෙරුවන් සරනයි ආදරයයි හැමදාම
239,මුන්ටඇත්තකියනකොටඉන්නබැබල්ලන්ටහොර
240,පිස්සන්ට පුලුවන්ද අහගෙන ඉන්න
241,එදා පැවසු ඒ වගවිිමේ වගවිය යුතු දේශපාලන බලය අද වන විට ජනතාව ලබා දිි තිබුනත් ඒ නිිතිමය බලය අවභාවිතා වන අයුරින් පලිගැනිිමේ චේතනාවෙන් පාවිච්චි නොකොට නිිතියේ ආධිපත්යය තහවුරු කර දේශපාලනිකව ඇගිලි නොගසා ස්වාධීන පරිික්ශණ දියත් කොට සාධාරණ ලෙස අධිකරණ ක්රියාවලිය මගින් තිිරණය කිරීමට ඉඩකඩ ලබාදීම අගය කරමි
242,කොච්චර පරන විඩියෝ එකක් බැලුවත් යුක්තියවෙනුවෙන් එකම හඩක් බලු කෙිදිරි නැ සිංහ හඩක් මයි
243,පුදුමයි අපිට මග හැරුනත් යුක්තිය ගැන දිගටම සටන්කරපු උතුමමෙක්
244,නියමයි දැන් අපේ ජනපති තුමාට ඇමති බංගලා වලින් ආදායමක් රටට ගන්නත් පුලුවන් මහින්ද හම්පඩයගෙ ර්ජයේ මාලිගා ඔක්කොම ගන්න ජනාධිපති තුමනි
245,කැනහිල්ලු ය්වමු ව්ෂ්සිකිවලට
246,අපේ සිංහයා
247,මට මේ කතාව ඇහෙන්නේ අනුර කුමාර දිසානායක ජනාධිපති උනාට පස්සෙ මේ මවුබිම රැකගැනීම ඔබ තුමාට ශක්තිය ධෛර්යය වාසනාව උදාවේවා ජය වේවා
248,අනේ ඔබතුමාට තෙරුවන් සරණයි ඔය ශක්තියට ඔය ධෛර්යයට ඔයඑඩිතර කමට අදජනපති
